Food Item,Rec 1,Rec 1 Location,Rec 2,Rec 2 Location,Rec 3,Rec 3 Location,Rec 4,Rec 4 Location
Whole Plain Greek Yogurt (v),Sliced Jack Cheese ,Greens & Grains,Raspberry Yogurt (v),Greens & Grains,Organic Fresh Strawberry ,Greens & Grains,Seedless Red Grape (vgn),Greens & Grains
Strawberry Yogurt (v),Sliced Swiss Cheese (v),Greens & Grains,Blueberry Yogurt (v),Greens & Grains,Honeydew & Berry Parfait (v),Greens & Grains,Sliced Genoa Salami,Greens & Grains
Watermelon (vgn),Sliced Provolone Cheese ,Greens & Grains,Jack Cheese ,Greens & Grains,Grapefruit Halves ,Greens & Grains,Caldo de Marisco,Greens & Grains
Grapefruit Halves (vgn),Sliced Cheddar Cheese ,Greens & Grains,Granola Cantaloupe Parfait ,Greens & Grains,Granola Cantaloupe Parfait (v),Greens & Grains,Italian Panini,Greens & Grains
Cantaloupe (vgn),Italian Tomato Panini ,Greens & Grains,Sliced Genoa Salami,Greens & Grains,Sliced Turkey Pastrami,Greens & Grains,Granola Honeydew Parfait (v),Greens & Grains
Make Your Own Waffle (v),Baked Oatmeal with Apple & Cinnamon (v),Greens & Grains,Fluffy Whole Wheat Waffles ,Greens & Grains,8 Grain Hot Cereal (vgn),Greens & Grains,Make Your Own Waffle ,Greens & Grains
Granola Raspberry Parfait (v),Sliced Cheddar Cheese ,Greens & Grains,Granola Cantaloupe Parfait ,Greens & Grains,Granola Cantaloupe Parfait (v),Greens & Grains,Italian Panini,Greens & Grains
Cinnamon Maple Granola (vgn),Caldo de Marisco,Greens & Grains,Grapefruit Halves ,Greens & Grains,Green Bean & Cucumber w/Miso (vgn),Greens & Grains,Flame Seedless Grape,Greens & Grains
Cream of Wheat (v),Cinnamon Maple Granola ,Greens & Grains,Watermelon ,Greens & Grains,Sliced Cheddar Cheese (v),Greens & Grains,Sliced Jack Cheese (v),Greens & Grains
Baby Spinach (vgn),Baked Sweet Potato ,Greens & Grains,Strawberry Salad w/Poppyseed Dressing(v),Greens & Grains,Jasmine Rice (vgn),Greens & Grains,Marinated Broccoli & Bean Salad (vgn),Greens & Grains
Flour Tortilla (vgn),Hawaiian Sweet Roll ,Bakery,Homemade Onion Bread ,Bakery,Sun Dried Tomato Bread (v),Bakery,Pesto Bread (v),Bakery
Banana Muffin (v),Brownie Pie (v),Bakery,Cinnamon Coffee Cake ,Bakery,Coconut Chiffon Cake ,Bakery,Mango Cake (v),Bakery
Raspberry White Chocolate Scone (v),Marble Cake (v),Bakery,Chocolate Flourless Cake ,Bakery,Chocolate Chocolate Chip Bar (v),Bakery,Granola Bar  ,Bakery
Fresh Cage Free Scrambled Eggs (v),Scrambled Eggs with Ham & Cheese,The Grill,Cage Free Scrambled Egg Whites (v),The Grill,Housemade Ketchup (vgn),The Grill,Pickled Red Onion ,The Grill
Cage Free Scrambled Egg Whites (v),Housemade Ketchup (vgn),The Grill,Pickled Red Onion ,The Grill,Fresh Cage Free Scrambled Eggs (v),The Grill,Housemade Ketchup ,The Grill
Breakfast Burrito (v),Malibu Burger ,The Grill,Mushroom Lentil Burger ,The Grill,Grilled Mediterranean Sandwich,The Grill,Bean and Cheese Burrito ,The Grill
Sausage Patty,Grilled Swiss & Tomato on Wheat (v),The Grill,Cage Free Scrambled Egg Whites ,The Grill,Grilled Ham,The Grill,Steamed Fresh Broccoli (vgn),The Grill
Cottage Fried Potatoes (vgn),Egg White and Vegetable Omelet ,The Grill,Potatoes O'Brien ,The Grill,Roasted Breakfast Potatoes ,The Grill,Refried Beans ,The Grill
Steamed Fresh Broccoli (vgn),Grilled Ham,The Grill,Sriracha Mayonnaise (v),The Grill,Cage Free Scrambled Egg Whites ,The Grill,Brussel Hash ,The Grill
Taco Salad,Vegetarian Taco Salad ,Greens & Grains,Chicken Chipotle Wrap,Greens & Grains,Vegetable Wrap ,Greens & Grains,Turkey Club Wrap,Greens & Grains
Chicken Fajita Wrap,Grilled Cajun Chicken Wrap,Greens & Grains,Panini Pizza ,Greens & Grains,Panini Pizza (v),Greens & Grains,Chipotle Hummus & Quinoa Wrap (vgn),Greens & Grains
Sliced Genoa Salami,Italian Tomato Panini ,Greens & Grains,Sliced Turkey Pastrami,Greens & Grains,Cantaloupe (vgn),Greens & Grains,Honeydew & Berry Parfait (v),Greens & Grains
Sliced Roast Beef,Sopa de Marisco (gf),Greens & Grains,Buckwheat Granola (w/nuts) (v),Greens & Grains,Granola Parfait ,Greens & Grains,Granola Honeydew Parfait ,Greens & Grains
Sliced Provolone Cheese (v),Blueberry Yogurt ,Greens & Grains,Chicken Congee,Greens & Grains,Quinoa (vgn),Greens & Grains,Pineapple ,Greens & Grains
Sliced Cheddar Cheese (v),Sliced Jack Cheese (v),Greens & Grains,Watermelon ,Greens & Grains,Sliced Swiss Cheese ,Greens & Grains,Cream of Wheat (v),Greens & Grains
Baked Sweet Potato (vgn),Quinoa Salad ,Greens & Grains,Basmati Rice (vgn),Greens & Grains,Steamed White Rice ,Greens & Grains,Egg Salad (v),Greens & Grains
Long Grain Rice (vgn),Steamed White Rice (vgn),Greens & Grains,Wild Rice ,Greens & Grains,Brown Rice ,Greens & Grains,Wild Rice (vgn),Greens & Grains
Roasted Tomato Soup (v),Spicy Black Bean Soup (v),Greens & Grains,Vegetable Minestrone Soup (vgn),Greens & Grains,Tomato Basil Soup (v),Greens & Grains,Turkey Vegetable Soup,Greens & Grains
Sugar Snap Peas (vgn),Couscous (vgn),Salad Bar Featured Items,Sweet &Tangy Pickled Red Onion (vgn),Salad Bar Featured Items,Orange Pickled Carrot Coins ,Salad Bar Featured Items,Ginger Sesame Tofu (vgn),Salad Bar Featured Items
Ginger Sesame Tofu (vgn),Orange Pickled Carrot Coins ,Salad Bar Featured Items,Bulgur Wheat ,Salad Bar Featured Items,Sugar Snap Peas (vgn),Salad Bar Featured Items,Couscous (vgn),Salad Bar Featured Items
Couscous (vgn),Sugar Snap Peas (vgn),Salad Bar Featured Items,Sweet &Tangy Pickled Red Onion (vgn),Salad Bar Featured Items,Orange Pickled Carrot Coins ,Salad Bar Featured Items,Ginger Sesame Tofu (vgn),Salad Bar Featured Items
Tomato Basil Flatbread (v),Three Cheese Flatbread ,The Brick,Bolognese Sauce,The Brick,Spicy Marinara Sauce ,The Brick,Marinara Sauce (vgn),The Brick
Three Cheese Pizza on White (v),Canadian Bacon and Pineapple Pizza,The Brick,Cheeseburger Pizza,The Brick,Three Cheese Pizza on White ,The Brick,Tomato Basil Pizza on White (v),The Brick
Fettuccine Pasta (vgn),Pasta Primavera ,The Brick,Grilled Salmon Pasta w/Roma Tomato,The Brick,Chef's Salmon Pasta,The Brick,Pasta Penne with Chicken & Mushrooms,The Brick
Tomato Cream Sauce (v),Sausage Marinara Sauce,The Brick,Bolognese Sauce with Pancetta,The Brick,Bolognese Sauce,The Brick,Three Cheese Flatbread ,The Brick
Potato Bread (v),Potato Bread ,Bakery,Chocolate Cookie ,Bakery,Baked Potato (vgn),Greens & Grains,Vegetable Fajita (v),Chef's Choice
Chocolate Chocolate Chip Bar (v),Marble Cake (v),Bakery,Raspberry White Chocolate Scone (v),Bakery,Chocolate Flourless Cake ,Bakery,Granola Bar  ,Bakery
Coconut Cream Pie (v),Cream Cheese Pie ,Bakery,White Cupcake with Buttercream Icing ,Bakery,Fluffy Almond Sugar Cookie (w/nuts)(vgn),Bakery,Blueberry Scone (v),Bakery
Grilled Chicken Taco,Breakfast Burrito ,Chef's Choice,Pulled Pork Buffalo Style Sandwich,Chef's Choice,Baked Hawaiian Ham & Turkey Sandwich,Chef's Choice,Cheese Enchilada ,Chef's Choice
Refried Beans (vgn),Red Potatoes with Rosemary (vgn),Chef's Choice,Potato Gorda with Black Beans ,Chef's Choice,Refried Black Beans (vgn),Chef's Choice,Roasted Potato Wedges ,Chef's Choice
Salsa de Tomatillo Verde (vgn),Fire Roasted Tomato Chipotle Salsa (vgn),Chef's Choice,Creamy Chipotle Salsa ,Chef's Choice,Salsa (vgn),Chef's Choice,Creamy Chipotle Salsa (v),Chef's Choice
Carrots with Fresh Thyme (vgn),Steamed Broccoli & Cauliflower (vgn),Chef's Choice,Rosemary Roasted Chicken Quarters,Chef's Choice,Meatloaf,Chef's Choice,Calabaza con Queso,Chef's Choice
Cilantro & Onion Mix (vgn),Chicken White Bean Chili,Chef's Choice,Mojo Roasted Chicken (Pollo Asado),Chef's Choice,Ratatouille (vgn),Chef's Choice,Turkey Meatloaf,Chef's Choice
Pork Mu Shu,California Club Sushi Plate,International,Spicy Shrimp Sushi,International,Spicy Tuna Sushi Plate,International,Cilantro & Onion Mix ,International
Moo Shu Vegetables with Tofu (vgn),Seasoned Vegetable Medley ,International,Spicy Tuna Brown Rice Sushi Plate,International,Vegetable Fried Rice (vgn),International,Seasoned Sweet Potato Halves ,International
Sticky Rice (vgn),Spinach with Garlic & Ginger ,International,Sauteed Vegetables Rice and Beans ,International,California Club Roll with Brown Rice,International,Grilled Ahi Tuna Bowl with Brown Rice,International
Spinach Stir Fried with Garlic (vgn),Vegetable Roll with Brown Rice (vgn),International,Vegetable Roll ,International,Mujaddara Lentils and Rice (v),International,Creole Beans and Rice (vgn),International
Spicy Scallop Sushi Roll,Roasted Tomato Salsa ,International,California Roll,International,Tempura Onion Roll ,International,Salmon Roll,International
Daikon Roll (vgn),Calamari Roll,International,Cucumber & Avocado Roll ,International,Fire Roasted Tomato Salsa (vgn),International,Chile Salsa ,International
Hamburger,Cheeseburger,The Grill,Grilled Turkey Burger,The Grill,Grass Fed Burger,The Grill,Black Bean Burger (vgn),The Grill
Baked Hawaiian Vegetarian Sandwich (v),Grilled BBQ Chicken Sandwich,The Grill,Grilled Vegetable and Bean Burrito (vgn),The Grill,Cheese Quesadilla with Chiles ,The Grill,Cheese Quesadilla (v),The Grill
Steak Fries (vgn),Eggplant Parmesan Casserole ,The Grill,Mushroom Tofu Veggie Slider (w/nuts) (v),The Grill,Mexican Scrambled Eggs ,The Grill,Crinkle Cut French Fries (vgn),The Grill
Chimichurri Sauce (vgn),Spicy Mustard Sauce (vgn),The Grill,Red Chimichurri Sauce (vgn),The Grill,Chimichurri Sauce ,The Grill,Tartar Sauce ,The Grill
Chipotle Aioli (v),Caramelized Onion Compote ,The Grill,Sauteed Cabbage & Tomatoes ,The Grill,Grilled Cheddar On Wheat ,The Grill,Mexican Scrambled Eggs (v),The Grill
Pumpkin Seed Pesto (v),Fresh Cage Free Scrambled Eggs ,The Grill,Shoestring Fries ,The Grill,Sauteed Zucchini with Garlic (vgn),The Grill,Grilled Cheese on Sourdough ,The Grill
Linguini Pasta (vgn),Corn Pasta Sauce (v),The Brick,Pasta Carbonara,The Brick,Whole Wheat Penne Pasta ,The Brick,Penne Arrabiata with Chicken,The Brick
Pasta Penne with Chicken & Mushrooms,Penne w/Butternut Squash Sauce ,The Brick,Grilled Salmon Pasta w/Roma Tomato,The Brick,Fettuccine Pasta (vgn),The Brick,Pasta Primavera ,The Brick
New York Style Crumb Cake (vgn),M&M Bar (w/nuts) (v),Bakery,Raspberry Swirl Coffee Cake,Bakery,Oatmeal Raisin Bar (w/nuts) (v),Bakery,Snickerdoodle Cookie (v),Bakery
Grilled Chicken Breast,Fresh Cauliflower & Carrots (vgn),Chef's Choice,Arroz con Pollo,Chef's Choice,Cilantro Lime Crema (v),Chef's Choice,Pork Chinese BBQ,Chef's Choice
Pasta Shells w/Eggplant & Marinara (vgn),Baked Pesto Pasta w/Chicken,Chef's Choice,Spinach and Matzo Lasagna ,Chef's Choice,Farfalle Pasta (vgn),Chef's Choice,Lasagna Bolognese,Chef's Choice
Spanish Rice w/Roasted Corn (vgn),Brisket and Potato Kugel,Chef's Choice,Roasted Potato Wedges (vgn),Chef's Choice,Fresh Green Beans with Garlic ,Chef's Choice,Potato Vegetable Kugel ,Chef's Choice
White Beans (vgn),Refried Black Beans ,Chef's Choice,Roasted Potato Salad w/Goat Cheese (v),Chef's Choice,Mashed Red Potatoes w/ Garlic ,Chef's Choice,Basmati Rice with Peas (vgn),Chef's Choice
Pho Broth for Soup,Vietnamese Turkey Banh Mi,International,Matzo Ball Chicken Soup,Chef's Choice,Tempura Onion Roll ,International,Spicy Scallop Sushi Plate,International
Miso Ramen (v),Korean Style Pork Ribs,International,Hot & Sour Pork Ribbons,International,Spicy Shrimp Sushi Plate,International,Chicken Shoyu,International
Braised Bok Choy (vgn),Hoisin Chicken,International,Bok Choy & Nappa Cabbage w/Sesame,International,California Sushi Plate,International,Mashed Yams (v),International
Spicy Scallop Sushi Plate,Vietnamese Turkey Banh Mi,International,Vindaloo Chicken,International,Beef Pad Thai with Peanuts (w/nuts),International,Fried Noodles (v),International
Blueberry Yogurt (v),Sliced Swiss Cheese (v),Greens & Grains,Sliced Pineapple (vgn),Greens & Grains,Strawberry Yogurt (v),Greens & Grains,Sopa de Marisco (gf),Greens & Grains
Honeydew Melon (vgn),Grits (vgn),Greens & Grains,Strawberry Yogurt ,Greens & Grains,Fresh Strawberry (vgn),Greens & Grains,Quinoa Breakfast Bowl  ,Greens & Grains
Seedless Red Grape (vgn),Swiss Cheese,Greens & Grains,Peach Yogurt ,Greens & Grains,Raspberry Yogurt ,Greens & Grains,Vanilla Yogurt (v),Greens & Grains
Granola Black & Blue Parfait (v),Peach Yogurt (v),Greens & Grains,Spicy Kale Caesar ,Greens & Grains,Sliced Swiss Cheese ,Greens & Grains,Sliced Jack Cheese (v),Greens & Grains
Bulgur Hot Cereal (vgn),Fluffy Whole Wheat Waffles (v),Greens & Grains,Bulgur Hot Cereal ,Greens & Grains,Oatmeal ,Greens & Grains,8 Grain Hot Cereal ,Greens & Grains
Chocolate Chip Scone (v),Applesauce Coffee Cake (v),Bakery,Pecan Sour Cream Coffee Cake (w/nuts)(v),Bakery,Blueberry Coffee Cake ,Bakery,Peanut Butter Fudge Cupcake  ,Bakery
Pumpkin Muffins (w/nuts) (v),Mango Cake ,Bakery,Lime Bar ,Bakery,Toll House Bar (v),Bakery,German Chocolate Cake  ,Bakery
Buttermilk Pancakes (v),Banana Chocolate Chip Pancakes (v),The Grill,Blueberry Pancakes (v),The Grill,Whole Wheat Banana Pancake (v),The Grill,Whole Wheat Pancake (v),The Grill
Shakshuka (v),Matzo Brei ,The Grill,Scrambled Eggs with Ham & Cheese,The Grill,Fresh Cage Free Scrambled Eggs (v),The Grill,Cage Free Scrambled Egg Whites (v),The Grill
Fried Potato with Onion (vgn),Home Fried Potatos ,The Grill,Fresh Sauteed Spinach ,The Grill,Fresh Sauteed Spinach (vgn),The Grill,Mixed Greens Side Salad ,The Grill
Fresh Cauliflower (vgn),Sauteed Kale ,The Grill,Cauliflower w/Sugar Snap Peas (vgn),The Grill,Grilled Cheddar On Wheat (v),The Grill,Chinese Stir-Fried Tomatoes & Eggs (v),The Grill
Chicken Caesar Salad,Baby Spinach ,Greens & Grains,Cornmeal Waffle ,Greens & Grains,Watermelon Salad ,Greens & Grains,Italian Bread Salad (v),Greens & Grains
Turkey Club Wrap,Chinese Chicken Salad Wrap,Greens & Grains,Greek Chicken Wrap,Greens & Grains,Chicken Caesar Wrap,Greens & Grains,Vegetable Wrap ,Greens & Grains
Sliced Turkey,Cantaloupe ,Greens & Grains,Quinoa (vgn),Greens & Grains,Sliced Provolone Cheese (v),Greens & Grains,Blueberry Yogurt ,Greens & Grains
Sliced Turkey Pastrami,Italian Tomato Panini ,Greens & Grains,Sliced Genoa Salami,Greens & Grains,Cantaloupe (vgn),Greens & Grains,Honeydew & Berry Parfait (v),Greens & Grains
Swiss Cheese,Seedless Red Grape (vgn),Greens & Grains,Peach Yogurt ,Greens & Grains,Raspberry Yogurt ,Greens & Grains,Vanilla Yogurt (v),Greens & Grains
Baked Potato (vgn),Cherry Tomato White Bean Salad (vgn),Greens & Grains,Baked Potato ,Greens & Grains,Vegetable & Quinoa Salad ,Greens & Grains,Ensalada de Fruta con Tajin (vgn),Greens & Grains
Brown Rice (vgn),Jicama Pico de Gallo Salad (vgn),Greens & Grains,Watermelon Salad ,Greens & Grains,Cornmeal Waffle ,Greens & Grains,Chicken Caesar Salad,Greens & Grains
Sweet Potato Corn & Chipotle Soup (v),Sweet Potato Coconut Soup (vgn),Greens & Grains,Turkey Rice Soup,Greens & Grains,Tortilla Soup (vgn),Greens & Grains,Tortilla Soup ,Greens & Grains
Sweet Potato Chicken Flatbread,Spinach & Ricotta Flatbread (v),The Brick,Risotto with Fresh Vegetables (vgn),The Brick,Fusilli w/Roasted Vegetable & Asiago (v),The Brick,Roasted Vegetable Marinara Sauce ,The Brick
Antipasto Pizza,Meatball Pizza,The Brick,Grilled BBQ Chicken Pizza,The Brick,Garlic Pizza on Wheat ,The Brick,Sausage Mushroom Pizza,The Brick
Creamy Rosemary Sauce (v),Creamy Pesto Sauce ,The Brick,Fresh Tomato Basil Sauce ,The Brick,Greek Tomato Sauce ,The Brick,Creamy Pesto Sauce (v),The Brick
Penne Pasta (vgn),Penne Pasta ,The Brick,Orzo Pasta with Vegetables ,The Brick,Penne w/Butternut Squash Sauce ,The Brick,Pasta Penne with Chicken & Mushrooms,The Brick
Thick Focaccia Bread (vgn),Hawaiian Sweet Roll (v),Bakery,Strawberry Cheese Bread Pudding(w/nuts(v,Bakery,Challah Bread ,Bakery,Hawaiian Sweet Bread (v),Bakery
Shortbread Cookie (v),Vanilla Cupcake w/Strawberry Icing (v),Bakery,Fluffy Almond Sugar Cookie ,Bakery,Rhubarb Stacking Cake (v),Bakery,Orange Scone (v),Bakery
Carrot Walnut Cupcakes (w/nuts) (v),Applesauce Coffee Cake (v),Bakery,Pecan Sour Cream Coffee Cake (w/nuts)(v),Bakery,Blueberry Coffee Cake ,Bakery,Peanut Butter Fudge Cupcake  ,Bakery
Vietnamese Beef BBQ Sub Sandwich,Bean Rice & Cheese Burrito (v),Chef's Choice,Hot Turkey Sandwich,Chef's Choice,Taco Rajas (vgn),Chef's Choice,Chicken Mole Enchiladas,Chef's Choice
Chili Mango Bok Choy Slaw (vgn),Chicken Mole,Chef's Choice,Kale with Fresh Garlic ,Chef's Choice,Sauteed Kale (vgn),Chef's Choice,Baked Rigatoni ,Chef's Choice
Sauteed Kale (vgn),Couscous w/Butternut Squash ,Chef's Choice,Turkey Melt,Chef's Choice,Chili Mango Bok Choy Slaw (vgn),Chef's Choice,Chicken Mole,Chef's Choice
Cajun Chicken Jambalaya,Hot & Sour Pork Ribbons,International,Miso Ramen (v),International,Roasted Cauliflower w/Garlic ,International,Korean Style Pork Ribs,International
Red Beans and Rice (vgn),Rice with Cilantro & Onions ,International,Sticky Rice ,International,Roasted Mixed Vegetables ,International,Stir Fried Chinese Greens (vgn),International
Fresh Cauliflower & Broccoli Mix (vgn),Bang Bang Broccoli ,International,Roasted Red Onion & Zucchini (vgn),International,Smoked Fish Fritters w/Beet Vinaigrette,International,Roasted Broccoli and Red Onion ,International
Vegetable Roll (vgn),Thai Tofu Curry w/ Vegetables ,International,Thai Vegetable & Peanut Noodle(w/nut,International,Teriyaki Chicken Rice Bowl,International,Seasoned Vegetable Medley (vgn),International
Spicy Tuna Roll,Shanghai Noodles & Chix w/Bean Sauce,International,Grilled Pineapple/Mango Salsa (vgn),International,Tempura Onion Roll (v),International,Hunan Noodles with Spicy Pork Sauce,International
Grilled Turkey Burger,Grass Fed Burger,The Grill,Cheeseburger,The Grill,Hamburger,The Grill,Black Bean Burger (vgn),The Grill
Mushroom Tofu Veggie Slider (w/nuts) (v),Eggplant Parmesan Casserole ,The Grill,Steak Fries (vgn),The Grill,Crinkle Cut French Fries (vgn),The Grill,Mexican Scrambled Eggs ,The Grill
Crinkle Cut French Fries (vgn),Mexican Scrambled Eggs ,The Grill,Steak Fries (vgn),The Grill,Fresh Cauliflower & Carrots ,The Grill,Huevos Rancheros ,The Grill
Spicy Mustard Sauce (vgn),Chimichurri Sauce (vgn),The Grill,Tartar Sauce ,The Grill,Red Chimichurri Sauce (vgn),The Grill,Chimichurri Sauce ,The Grill
Butternut Squash Risotto (v),Linguini with Pesto (v),The Brick,Roasted Chicken & Zucchini Marinara,The Brick,Maple Syrup ,The Brick,Rigatoni Mozzarella ,The Brick
Whole Wheat Penne Pasta (vgn),Pasta with Grilled Vegetables (vgn),The Brick,Fresh Tomato Basil Garlic Pasta (vgn),The Brick,Pasta with Grilled Vegetables ,The Brick,Chickpea Pasta,The Brick
Sticky Toffee Pudding (vgn),Chocolate Pudding (v),Bakery,Apple Crisp ,Bakery,Assorted Bagels & Condiments,Bakery,Apple Kuchen ,Bakery
Rosemary Roasted Chicken Quarters,Carrots with Fresh Thyme (vgn),Chef's Choice,Steamed Broccoli & Cauliflower (vgn),Chef's Choice,Meatloaf,Chef's Choice,Calabaza con Queso,Chef's Choice
Chipotle Roasted Potatoes (vgn),Roasted Potato Wedges ,Chef's Choice,Vegetable Fajita ,Chef's Choice,Refried Black Beans (vgn),Chef's Choice,Potato Gorda with Black Beans ,Chef's Choice
Ratatouille (vgn),Cilantro & Onion Mix (vgn),Chef's Choice,Mojo Roasted Chicken (Pollo Asado),Chef's Choice,Chicken White Bean Chili,Chef's Choice,Chicken & Dumplings,Chef's Choice
Sauteed Cabbage & Carrots (vgn),Ropa Vieja,Chef's Choice,Carrot & Zucchini with Lemon Butter ,Chef's Choice,Herb Marinated Rotisserie Chicken,Chef's Choice,Ground Beef and Bean Tostada,Chef's Choice
Teriyaki Broccoli Beef Stir Fry,Broccoli Spinach Bok Choy Stir Fry (vgn),International,Vegetable Medley Stir Fry ,International,Teriyaki Chicken Stir Fry,International,Broccoli Spinach Bok Choy Stir Fry ,International
Broccoli Spinach Bok Choy Stir Fry (vgn),Vegetable Medley Stir Fry ,International,Teriyaki Broccoli Beef Stir Fry,International,Teriyaki Chicken Stir Fry,International,Broccoli Spinach Bok Choy Stir Fry ,International
Tofu Teriyaki Bowl (vgn),Vietnamese Turkey Banh Mi,International,Spicy Scallop Sushi Plate,International,Beef Pad Thai with Peanuts (w/nuts),International,Fried Noodles (v),International
Spicy Tuna Sushi Plate,Spicy Shrimp Sushi,International,Stir Fried Bok Choy (vgn),International,Steamed Broccoli & Cauliflower ,International,Pork Mu Shu,International
Vanilla Yogurt (v),Raspberry Yogurt ,Greens & Grains,Peach Yogurt ,Greens & Grains,Seedless Red Grape (vgn),Greens & Grains,Swiss Cheese,Greens & Grains
Sliced Pineapple (vgn),Blueberry Yogurt (v),Greens & Grains,Sliced Swiss Cheese (v),Greens & Grains,Sopa de Marisco (gf),Greens & Grains,Buckwheat Granola (w/nuts) (v),Greens & Grains
Quinoa Breakfast Bowl (w/nuts) (v),Granola Black & Blue Parfait ,Greens & Grains,Peanut Butter & Banana Oats  ,Greens & Grains,Pineapple ,Greens & Grains,Chicken Congee,Greens & Grains
Oatmeal (vgn),Oatmeal ,Greens & Grains,Fluffy Whole Wheat Waffles (v),Greens & Grains,Bulgur Hot Cereal (vgn),Greens & Grains,Bulgur Hot Cereal ,Greens & Grains
Cornbread Muffin (v),Applesauce Coffee Cake (v),Bakery,Pecan Sour Cream Coffee Cake (w/nuts)(v),Bakery,Blueberry Coffee Cake ,Bakery,Peanut Butter Fudge Cupcake  ,Bakery
Pecan Sour Cream Coffee Cake (w/nuts)(v),Applesauce Coffee Cake (v),Bakery,Cornbread Muffin (v),Bakery,Blueberry Coffee Cake ,Bakery,Peanut Butter Fudge Cupcake  ,Bakery
Grilled Ham,Steamed Fresh Broccoli (vgn),The Grill,Sriracha Mayonnaise (v),The Grill,Cage Free Scrambled Egg Whites ,The Grill,Brussel Hash ,The Grill
Blueberry Pancakes (v),Apple Cranberry Pancake Topping ,The Grill,Banana Chocolate Chip Pancakes (v),The Grill,Whole Wheat Banana Pancake (v),The Grill,Whole Wheat Pancake (v),The Grill
Potatoes O'Brien (vgn),Roasted Vegetables ,The Grill,Roasted Breakfast Potato ,The Grill,Fresh Vegetable Medley w/Spinach ,The Grill,Mixed Greens Side Salad (vgn),The Grill
Strawberry Salad w/Poppyseed Dressing(v),Baked Sweet Potato ,Greens & Grains,Baby Spinach (vgn),Greens & Grains,Marinated Broccoli & Bean Salad (vgn),Greens & Grains,Jasmine Rice (vgn),Greens & Grains
Italian Panini,Dragon Noodles ,Greens & Grains,Granola Raspberry Parfait (v),Greens & Grains,Granola Cantaloupe Parfait (v),Greens & Grains,Sliced Cheddar Cheese ,Greens & Grains
Sliced Ham,Seedless Red Grape ,Greens & Grains,Whole Plain Greek Yogurt ,Greens & Grains,Rainbow Peanut Noodles w/Chicken(w/nuts),Greens & Grains,Sliced Pineapple ,Greens & Grains
Sliced Jack Cheese (v),Sliced Cheddar Cheese (v),Greens & Grains,Sliced Swiss Cheese ,Greens & Grains,Watermelon ,Greens & Grains,Spicy Kale Caesar ,Greens & Grains
Basmati Rice (vgn),Quinoa Salad ,Greens & Grains,Baked Sweet Potato (vgn),Greens & Grains,Steamed White Rice ,Greens & Grains,Zucchini Quinoa Green Bean Salad ,Greens & Grains
Turkey Rice Soup,Tortilla Soup (vgn),Greens & Grains,Tortilla Soup ,Greens & Grains,Minestrone Soup ,Greens & Grains,Sweet Potato Coconut Soup (vgn),Greens & Grains
Quattro Formaggio Pizza on Wheat (v),Pepperoni Pizza,The Brick,Taco Pizza,The Brick,Chicken Florentine Pizza w/White Sauce,The Brick,Salami Pizza,The Brick
Roasted Pepper Tomato Sausage Sauce,Marinara Sauce with Sausage,The Brick,Alburro Sauce (v),The Brick,White Wine Garlic Sauce with Chicken,The Brick,Greek Tomato Sauce ,The Brick
Spaghetti (vgn),Fettucine Alfredo,The Brick,Mushroom Carbonara ,The Brick,Fresh Basil Pesto (v),The Brick,Chilaquiles (No Egg),The Brick
Creamy Pesto Sauce (v),Bolognaise Sauce,The Brick,Fresh Tomato Basil Sauce ,The Brick,Caprese Flatbread w/Balsamic Reduction,The Brick,Tomato and Roasted Garlic Sauce (vgn),The Brick
Three Grain Bread (v),Blueberry Bread ,Bakery,Flour Tortilla ,Bakery,Russian Bread (v),Bakery,Herb Focaccia Bread ,Bakery
Lemon Cookie (v),Applesauce Coffee Cake (v),Bakery,Cornbread Muffin (v),Bakery,Blueberry Coffee Cake ,Bakery,Peanut Butter Fudge Cupcake  ,Bakery
Killer Brownie (w/nuts) (v),Mexican Chocolate Cake (v),Bakery,Mint Chocolate Chip Cookie ,Bakery,Mocha Cupcake (v),Bakery,Blueberry Scone ,Bakery
Chicken Mole,Chili Mango Bok Choy Slaw (vgn),Chef's Choice,Kale with Fresh Garlic ,Chef's Choice,Sauteed Kale (vgn),Chef's Choice,Baked Rigatoni ,Chef's Choice
Mexican Rice (vgn),Ensalada Cubana (vgn),Chef's Choice,Cuban Style Black Beans & Rice (vgn),Chef's Choice,Yellow Rice ,Chef's Choice,Roasted Root Vegetables ,Chef's Choice
Radish and Jalapeno Slaw (vgn),Shredded Braised Beef,Chef's Choice,Baked Rigatoni (v),Chef's Choice,Fried Eggs ,Chef's Choice,Roasted Yam w/Rosemary & Chile ,Chef's Choice
Refried Black Beans (vgn),Potato Gorda with Black Beans ,Chef's Choice,Chipotle Roasted Potatoes (vgn),Chef's Choice,Roasted Potato Wedges ,Chef's Choice,Red Potatoes with Rosemary (vgn),Chef's Choice
Roasted Cauliflower with Cumin (vgn),Beef Gravy,Chef's Choice,Honey Sriracha Glaze Brussel Sprouts ,Chef's Choice,Chicken Gyro,Chef's Choice,Egg & Arugula & Herb Tartine (v),Chef's Choice
Chicken Satay & Peanut Sauce (w/nuts),Spicy Eggplant Broc w/Ginger Sauce(vgn),International,California Club Roll,International,Chermoula Sauce (vgn),International,Salsa ,International
Roasted Red Onion & Zucchini (vgn),Bang Bang Broccoli ,International,Smoked Fish Fritters w/Beet Vinaigrette,International,Fresh Cauliflower & Broccoli Mix (vgn),International,Bang Bang Broccoli (vgn),International
Calamari Roll,Cucumber & Avocado Roll ,International,Daikon Roll (vgn),International,Fire Roasted Tomato Salsa (vgn),International,Hunan Noodles with Spicy Pork Sauce,International
Asparagus & Egg Roll (v),Salmon Roll,International,Daikon Roll ,International,Cucumber & Avocado Roll (vgn),International,Korean BBQ Sauce (vgn),International
Grass Fed Burger,Grilled Turkey Burger,The Grill,Black Bean Burger (vgn),The Grill,Vegetarian Cuban Sandwich (v),The Grill,Cheeseburger,The Grill
Shoestring Fries (vgn),Brussel Hash (v),The Grill,Grilled Cheese Chile & Veggie on Sour(v,The Grill,Scrambled Eggs w/Cheese & Mushroom ,The Grill,Grilled Cheese and Tomato on Wheat (v),The Grill
Focaccia with Vegetables & Pesto (v),Potatoes O'Brien ,The Grill,Egg White and Vegetable Omelet ,The Grill,Cottage Fried Potatoes (vgn),The Grill,Fresh Sauteed Spinach ,The Grill
